Sheet: Congés 2022
B2: 01 | C2: 02 | D2: 03 | E2: 04 | F2: 05 | G2: 06 | H2: 07 | I2: 08 | J2: 09 | K2: 10 | L2: 11 | M2: 12 | N2: 13 | O2: 14 | P2: 15 | Q2: 16 | R2: 17 | S2: 18 | T2: 19 | U2: 20 | V2: 21 | W2: 22 | X2: 23 | Y2: 24 | Z2: 25 | AA2: 26 | AB2: 27 | AC2: 28 | AD2: 29 | AE2: 30 | AF2: 31 | AH2: c | AI2: congés | AJ2: r | AK2: Récup | AL2: d | AM2: Délai de route | AN2: < | AO2: Congé que matin
A3: Janvier | B3: s | C3: d | D3: l | E3: m | F3: m | G3: j | H3: v | I3: s | J3: d | K3: l | L3: m | M3: m | N3: j | O3: v | P3: s | Q3: d | R3: l | S3: m | T3: m | U3: j | V3: v | W3: s | X3: d | Y3: l | Z3: m | AA3: m | AB3: j | AC3: v | AD3: s | AE3: d | AF3: l | AN3: > | AO3: Congé que soir
A4: Février | B4: m | C4: m | D4: j | E4: v | F4: s | G4: d | H4: l | I4: m | J4: m | K4: j | L4: v | M4: s | N4: d | O4: l | P4: m | Q4: m | R4: j | S4: v | T4: s | U4: d | V4: l | W4: m | X4: m | Y4: j | Z4: v | AA4: s | AB4: d | AC4: l | AH4: a | AI4: Artt | AK4: Fractionnement | AM4: Autre | AN4: Lettre | AO4: Précise nature de la demi-journée si nécessaire
A5: Mars | B5: m | C5: m | D5: j | E5: v | F5: s | G5: d | H5: l | I5: m | J5: m | K5: j | L5: v | M5: s | N5: d | O5: l | P5: m | Q5: m | R5: j> | S5: v | T5: s | U5: d | V5: l | W5: m | X5: m | Y5: j | Z5: v | AA5: s | AB5: d | AC5: l | AD5: m | AE5: m | AF5: j
A6: Avril | B6: v | C6: s | D6: d | E6: l | F6: m | G6: m> | H6: j | I6: v | J6: s | K6: d | L6: l | M6: m | N6: m | O6: j | P6: v | Q6: s | R6: d | S6: l | T6: m | U6: m | V6: <j | W6: v | X6: s | Y6: d | Z6: l | AA6: m | AB6: m | AC6: j | AD6: v> | AE6: s | AI6: CET | AK6: Formation | AM6: Maladie
A7: Mai | B7: d | C7: l | D7: m | E7: m | F7: j | G7: v | H7: s | I7: d | J7: l | K7: m | L7: m | M7: j | N7: v | O7: s | P7: d | Q7: l | R7: m | S7: m | T7: j | U7: v | V7: s | W7: d | X7: l | Y7: m | Z7: m | AA7: j | AB7: v | AC7: s | AD7: d | AE7: l | AF7: m
A8: Juin | B8: m | C8: j | D8: v | E8: s | F8: d | G8: l | H8: m | I8: m | J8: j | K8: v | L8: s | M8: d | N8: l | O8: m | P8: m | Q8: j | R8: v | S8: s | T8: d | U8: l | V8: m | W8: m | X8: j | Y8: v | Z8: s | AA8: d | AB8: l | AC8: m | AD8: m | AE8: j
A9: Juillet | B9: v | C9: s | D9: d | E9: l | F9: m | G9: m | H9: j | I9: v | J9: s | K9: d | L9: l | M9: m | N9: m | O9: j | P9: v | Q9: s | R9: d | S9: l | T9: m | U9: m | V9: j | W9: v | X9: s | Y9: d | Z9: l | AA9: m | AB9: m | AC9: j | AD9: v | AE9: s | AF9: d | AH9: Motif | AI9: Acquis | AJ9: Consommés | AK9: Restant | AL9: Prévision | AM9: Restant avec prévision
A10: Août | B10: l | C10: m | D10: m | E10: j | F10: v | G10: s | H10: d | I10: l | J10: m | K10: m | L10: j | M10: v | N10: s | O10: d | P10: l | Q10: m | R10: m | S10: j | T10: v | U10: s | V10: d | W10: l | X10: m | Y10: m | Z10: j | AA10: v | AB10: s | AC10: d | AD10: l | AE10: m | AF10: m | AH10: Congés | AI10: 25 | AJ10: 13 | AK10: of:=[.AI10]-[.AJ10] -> 12 | AL10: 5 | AM10: of:=[.AK10]-[.AL10] -> 7
A11: Septembre | B11: j | C11: v | D11: s | E11: d | F11: l | G11: m | H11: m | I11: j | J11: v | K11: s | L11: d | M11: l | N11: m | O11: m | P11: j | Q11: v | R11: s | S11: d | T11: l | U11: m | V11: m | W11: j | X11: v | Y11: s | Z11: d | AA11: l | AB11: m | AC11: m | AD11: j | AE11: v | AH11: ARTT | AI11: 19 | AJ11: 16 | AK11: of:=[.AI11]-[.AJ11] -> 3 | AL11: 0 | AM11: of:=[.AK11]-[.AL11] -> 3
A12: Octobre | B12: s | C12: d | D12: l | E12: m | F12: m | G12: j | H12: v | I12: s | J12: d | K12: l | L12: m | M12: m | N12: j | O12: v | P12: s | Q12: d | R12: l | S12: m | T12: m | U12: j | V12: v | W12: s | X12: d | Y12: l | Z12: m | AA12: m | AB12: j | AC12: v | AD12: s | AE12: d | AF12: l | AH12: Fractionnement | AI12: 2 | AJ12: 0 | AK12: of:=[.AI12]-[.AJ12] -> 2 | AL12: 0 | AM12: of:=[.AK12]-[.AL12] -> 2
A13: Novembre | B13: m | C13: m | D13: j | E13: v | F13: s | G13: d | H13: l | I13: m | J13: m | K13: j | L13: v | M13: s | N13: d | O13: l | P13: m | Q13: m | R13: j | S13: v | T13: s | U13: d | V13: l | W13: m | X13: m | Y13: j | Z13: v | AA13: s | AB13: d | AC13: l | AD13: m | AE13: m | AH13: CET | AI13: 2.5 | AJ13: 0.5 | AK13: of:=[.AI13]-[.AJ13] -> 2 | AL13: 0 | AM13: of:=[.AK13]-[.AL13] -> 2
A14: Décembre | B14: j | C14: v | D14: s | E14: d | F14: l | G14: m | H14: m | I14: j | J14: v | K14: s | L14: d | M14: l | N14: m | O14: m | P14: j | Q14: v | R14: s | S14: d | T14: l | U14: m | V14: m | W14: j | X14: v | Y14: s | Z14: d | AA14: l | AB14: m | AC14: m | AD14: j | AE14: v | AF14: s | AH14: Autres | AI14: 0 | AJ14: 0 | AK14: of:=[.AI14]-[.AJ14] -> 0 | AL14: 0 | AM14: of:=[.AK14]-[.AL14] -> 0
AH15: Total | AI15: of:=[.AI10]+[.AI11]+[.AI12]+[.AI13]+[.AI14] -> 48.5 | AJ15: of:=[.AJ10]+[.AJ11]+[.AJ12]+[.AJ13]+[.AJ14] -> 29.5 | AK15: of:=[.AK10]+[.AK11]+[.AK12]+[.AK13]+[.AK14] -> 19 | AL15: of:=[.AL10]+[.AL11]+[.AL12]+[.AL13]+[.AL14] -> 5 | AM15: of:=[.AM10]+[.AM11]+[.AM12]+[.AM13]+[.AM14] -> 14
AP16: Les congés seront pris en utilisant la rubrique « jours de repos compensateur », en précisant dans la zone commentaire la référence de cette note et le solde des congés à prendre (« A l’issue de ce congé il me restera X jours de repos compensateurs »).

Sheet: Congés 2020
B2: 01 | C2: 02 | D2: 03 | E2: 04 | F2: 05 | G2: 06 | H2: 07 | I2: 08 | J2: 09 | K2: 10 | L2: 11 | M2: 12 | N2: 13 | O2: 14 | P2: 15 | Q2: 16 | R2: 17 | S2: 18 | T2: 19 | U2: 20 | V2: 21 | W2: 22 | X2: 23 | Y2: 24 | Z2: 25 | AA2: 26 | AB2: 27 | AC2: 28 | AD2: 29 | AE2: 30 | AF2: 31 | AH2: c | AI2: congés | AJ2: r | AK2: Récup | AL2: d | AM2: Délai de route | AN2: < | AO2: Congé que matin
A3: Janvier | B3: m | C3: j | D3: v | E3: s | F3: d | G3: l | H3: m | I3: m | J3: j | K3: v | L3: s | M3: d | N3: l | O3: m | P3: m> | Q3: j | R3: v | S3: s | T3: d | U3: l | V3: m | W3: m | X3: j | Y3: v | Z3: s | AA3: d | AB3: l | AC3: m | AD3: m | AE3: j | AF3: v | AN3: > | AO3: Congé que soir
A4: Février | B4: s | C4: d | D4: l | E4: m | F4: m> | G4: j | H4: v | I4: s | J4: d | K4: l | L4: m | M4: m> | N4: j | O4: v | P4: s | Q4: d | R4: l | S4: m | T4: m | U4: j | V4: v | W4: s | X4: d | Y4: l | Z4: m | AA4: m | AB4: j | AC4: v | AD4: s | AH4: a | AI4: Artt | AK4: Fractionnement | AM4: Autre | AN4: Lettre | AO4: Précise nature de la demi-journée si nécessaire
A5: Mars | B5: d | C5: l | D5: m | E5: m | F5: j | G5: v | H5: s | I5: d | J5: l | K5: m | L5: m> | M5: j | N5: v | O5: s | P5: d | Q5: l | R5: m | S5: m | T5: j | U5: v | V5: s | W5: d | X5: l | Y5: m | Z5: m | AA5: j | AB5: v | AC5: s | AD5: d | AE5: l | AF5: m
A6: Avril | B6: m | C6: j | D6: v | E6: s | F6: d | G6: l | H6: m | I6: m | J6: j | K6: v | L6: s | M6: d | N6: l | O6: m | P6: m | Q6: j | R6: v | S6: s | T6: d | U6: l | V6: m | W6: m | X6: j | Y6: v | Z6: s | AA6: d | AB6: l | AC6: m | AD6: m | AE6: j | AI6: CET | AK6: Formation | AM6: Maladie
A7: Mai | B7: v | C7: s | D7: d | E7: l | F7: m | G7: m | H7: j | I7: v | J7: s | K7: d | L7: l | M7: m | N7: m | O7: j | P7: v | Q7: s | R7: d | S7: l | T7: m | U7: m | V7: j | W7: v | X7: s | Y7: d | Z7: l | AA7: m | AB7: m | AC7: j | AD7: v | AE7: s | AF7: d
A8: Juin | B8: l | C8: m | D8: m | E8: j | F8: v | G8: s | H8: d | I8: l | J8: m | K8: m | L8: j | M8: v | N8: s | O8: d | P8: l | Q8: m | R8: m | S8: j | T8: v | U8: s | V8: d | W8: l | X8: m | Y8: m | Z8: j | AA8: v | AB8: s | AC8: d | AD8: l | AE8: m
A9: Juillet | B9: m | C9: j | D9: v | E9: s | F9: d | G9: l | H9: m | I9: m | J9: j | K9: v | L9: s | M9: d | N9: l | O9: m | P9: m | Q9: j | R9: v | S9: s | T9: d | U9: l | V9: m | W9: m | X9: j | Y9: v | Z9: s | AA9: d | AB9: l | AC9: m | AD9: m | AE9: j | AF9: v | AH9: Motif | AI9: Acquis | AJ9: Consommés | AK9: Restant | AL9: Prévision | AM9: Restant avec prévision
A10: Août | B10: s | C10: d | D10: l | E10: m | F10: m | G10: j | H10: v | I10: s | J10: d | K10: l | L10: m | M10: m | N10: j | O10: v | P10: s | Q10: d | R10: l | S10: m | T10: m | U10: j | V10: v | W10: s | X10: d | Y10: l | Z10: m | AA10: m | AB10: j | AC10: v | AD10: s | AE10: d | AF10: l | AH10: Congés | AI10: 25 | AJ10: 14 | AK10: of:=[.AI10]-[.AJ10] -> 11 | AL10: 11 | AM10: of:=[.AK10]-[.AL10] -> 0
A11: Septembre | B11: m | C11: m | D11: j | E11: v | F11: s | G11: d | H11: l | I11: m | J11: m | K11: j | L11: v | M11: s | N11: d | O11: l | P11: m | Q11: m | R11: j | S11: v | T11: s | U11: d | V11: l | W11: m | X11: m | Y11: j | Z11: v | AA11: s | AB11: d | AC11: l | AD11: m | AE11: m | AH11: ARTT | AI11: 14 | AJ11: 14 | AK11: of:=[.AI11]-[.AJ11] -> 0 | AL11: 0 | AM11: of:=[.AK11]-[.AL11] -> 0
A12: Octobre | B12: j | C12: v | D12: s | E12: d | F12: l | G12: m | H12: m | I12: j | J12: v | K12: s | L12: d | M12: l | N12: m | O12: m | P12: j | Q12: v | R12: s | S12: d | T12: l | U12: m | V12: m | W12: j | X12: v | Y12: s | Z12: d | AA12: l | AB12: m | AC12: m | AD12: j | AE12: v | AF12: s | AH12: Fractionnement | AI12: 2 | AJ12: 0 | AK12: of:=[.AI12]-[.AJ12] -> 2 | AL12: 0 | AM12: of:=[.AK12]-[.AL12] -> 2
A13: Novembre | B13: d | C13: l | D13: m | E13: m | F13: j | G13: v | H13: s | I13: d | J13: l | K13: m | L13: m | M13: j | N13: v | O13: s | P13: d | Q13: l | R13: m | S13: m | T13: j | U13: v | V13: s | W13: d | X13: l | Y13: m | Z13: m | AA13: j | AB13: v | AC13: s | AD13: d | AE13: l | AH13: CET | AI13: 2 | AJ13: 0 | AK13: of:=[.AI13]-[.AJ13] -> 2 | AL13: 0 | AM13: of:=[.AK13]-[.AL13] -> 2
A14: Décembre | B14: m | C14: m | D14: j | E14: v | F14: s | G14: d | H14: l | I14: m | J14: m | K14: j | L14: v | M14: s | N14: d | O14: l | P14: m | Q14: m | R14: j | S14: v | T14: s | U14: d | V14: l | W14: m | X14: m | Y14: j | Z14: v | AA14: s | AB14: d | AC14: l | AD14: m | AE14: m | AF14: j | AH14: Autres | AI14: 0 | AJ14: 0 | AK14: of:=[.AI14]-[.AJ14] -> 0 | AL14: 0 | AM14: of:=[.AK14]-[.AL14] -> 0
AH15: Total | AI15: of:=[.AI10]+[.AI11]+[.AI12]+[.AI13]+[.AI14] -> 43 | AJ15: of:=[.AJ10]+[.AJ11]+[.AJ12]+[.AJ13]+[.AJ14] -> 28 | AK15: of:=[.AK10]+[.AK11]+[.AK12]+[.AK13]+[.AK14] -> 15 | AL15: of:=[.AL10]+[.AL11]+[.AL12]+[.AL13]+[.AL14] -> 11 | AM15: of:=[.AM10]+[.AM11]+[.AM12]+[.AM13]+[.AM14] -> 4
AP16: Les congés seront pris en utilisant la rubrique « jours de repos compensateur », en précisant dans la zone commentaire la référence de cette note et le solde des congés à prendre (« A l’issue de ce congé il me restera X jours de repos compensateurs »).